{
  "schema_version": 1,
  "classification": "demo-safe",
  "date_semantics": "fictional-metadata-only",
  "entries": [
    { "asset_id": "DRV-001", "fictional_date": "1996-04-18", "phase": "proposal-1996", "label_ja": "Relay Pair企画書" },
    { "asset_id": "DRV-007", "fictional_date": "1996-04-18", "phase": "proposal-1996", "label_ja": "Relay Pair module付録" },
    { "asset_id": "DRV-015", "fictional_date": "1996-11-10", "phase": "location-test-1996", "label_ja": "ロケテストsession表" },
    { "asset_id": "DRV-016", "fictional_date": "1996-11-10", "phase": "location-test-1996", "label_ja": "ロケテスト集計memo" },
    { "asset_id": "DRV-012", "fictional_date": "1996-11-22", "phase": "location-test-1996", "label_ja": "RELAY_MASTER OLD_2P sheet" },
    { "asset_id": "DRV-024", "fictional_date": "1996-12-05", "phase": "location-test-1996", "label_ja": "絵コンテscene metadata" },
    { "asset_id": "DRV-002", "fictional_date": "1997-02-03", "phase": "transition-1997", "label_ja": "1人用移行notes" },
    { "asset_id": "DRV-008", "fictional_date": "1997-02-03", "phase": "transition-1997", "label_ja": "1人用移行議事録" },
    { "asset_id": "DRV-009", "fictional_date": "1997-09-30", "phase": "transition-1997", "label_ja": "没シナリオ稿" },
    { "asset_id": "DRV-011", "fictional_date": "1997-11-14", "phase": "transition-1997", "label_ja": "基板とROM予算memo" },
    { "asset_id": "DRV-025", "fictional_date": "1998-04-22", "phase": "production-1998", "label_ja": "サウンド指示書" },
    { "asset_id": "DRV-022", "fictional_date": "1998-05-08", "phase": "production-1998", "label_ja": "アートバイブル" },
    { "asset_id": "DRV-003", "fictional_date": "1998-06-12", "phase": "production-1998", "label_ja": "最終仕様書 gameplay章" },
    { "asset_id": "DRV-004", "fictional_date": "1998-06-12", "phase": "production-1998", "label_ja": "RELAY_MASTER 速度と得点" },
    { "asset_id": "DRV-010", "fictional_date": "1998-06-12", "phase": "production-1998", "label_ja": "最終仕様書 stage章" },
    { "asset_id": "DRV-013", "fictional_date": "1998-06-12", "phase": "production-1998", "label_ja": "RELAY_MASTER ENEMY sheet" },
    { "asset_id": "DRV-014", "fictional_date": "1998-06-12", "phase": "production-1998", "label_ja": "RELAY_MASTER STAGE sheet" },
    { "asset_id": "DRV-006", "fictional_date": "1998-06-20", "phase": "production-1998", "label_ja": "symbol索引 thin projection" },
    { "asset_id": "DRV-027", "fictional_date": "1998-06-20", "phase": "production-1998", "label_ja": "core step source" },
    { "asset_id": "DRV-028", "fictional_date": "1998-06-20", "phase": "production-1998", "label_ja": "Return Pass source" },
    { "asset_id": "DRV-023", "fictional_date": "1998-06-30", "phase": "production-1998", "label_ja": "sprite bank配置metadata" },
    { "asset_id": "DRV-005", "fictional_date": "1998-07-01", "phase": "release-1998", "label_ja": "取扱説明書抜粋" },
    { "asset_id": "DRV-020", "fictional_date": "1998-07-15", "phase": "release-1998", "label_ja": "営業運営manual" },
    { "asset_id": "DRV-021", "fictional_date": "1998-07-20", "phase": "release-1998", "label_ja": "インストカードtext projection" },
    { "asset_id": "DRV-017", "fictional_date": "1998-08-20", "phase": "qa-1998", "label_ja": "QAバグ表" },
    { "asset_id": "DRV-018", "fictional_date": "1998-08-24", "phase": "qa-1998", "label_ja": "BUG-021個票" },
    { "asset_id": "DRV-019", "fictional_date": "1998-08-27", "phase": "qa-1998", "label_ja": "BUG-047個票" },
    { "asset_id": "DRV-030", "fictional_date": "1998-08-27", "phase": "qa-1998", "label_ja": "ZERO LAP replay" },
    { "asset_id": "DRV-026", "fictional_date": "1998-09-03", "phase": "qa-1998", "label_ja": "sound ROM配置表" },
    { "asset_id": "DRV-029", "fictional_date": "1998-09-10", "phase": "qa-1998", "label_ja": "symbol索引 full" }
  ]
}
